{
  "$schema": "http://json-schema.org/draft-07/schema#",
  "title": "Universal Transcriber Domain Playbook Schema (v1)",
  "description": "JSON Schema v7 specification for Universal Transcriber domain playbooks.",
  "type": "object",
  "required": [
    "name",
    "default_role",
    "roles",
    "cues"
  ],
  "properties": {
    "$schema": {
      "type": "string"
    },
    "name": {
      "type": "string",
      "pattern": "^[a-zA-Z0-9_-]+$",
      "minLength": 1,
      "maxLength": 64,
      "description": "Unique identifier for the playbook."
    },
    "version": {
      "type": "string",
      "description": "Version string for the playbook definition (e.g. 'v1', 'v2')."
    },
    "description": {
      "type": "string",
      "description": "Human-readable description of the domain context."
    },
    "default_role": {
      "type": "string",
      "minLength": 1,
      "description": "Default speaker label assigned when no specific role or roster match triggers."
    },
    "roles": {
      "type": "array",
      "items": {
        "type": "string"
      },
      "minItems": 1,
      "description": "List of recognized roles in this conversational domain."
    },
    "cues": {
      "type": "object",
      "additionalProperties": {
        "type": "array",
        "items": {
          "type": "string"
        }
      },
      "description": "Mapping of role keys to conversational trigger phrases."
    },
    "default_roster": {
      "type": "array",
      "items": {
        "type": "string"
      },
      "description": "List of known participant names for automated entity linking."
    },
    "chair_roles": {
      "type": "array",
      "items": {
        "type": "string"
      },
      "description": "Roles that possess parliamentary presiding authority (e.g. Chair, President)."
    },
    "affirmative_cues": {
      "type": "array",
      "items": {
        "type": "string"
      },
      "description": "Phrases signaling vote assent or attendance confirmation in roll calls."
    },
    "negative_cues": {
      "type": "array",
      "items": {
        "type": "string"
      },
      "description": "Phrases signaling vote dissent or absence in roll calls."
    }
  },
  "additionalProperties": false
}
